"Definition","is_misogyny"
"Texas State University is THE university of choice to blow your load and maintain a 3.0. Hated by the majority of universities in the state, TxState boasts the prettiest campus, best location, and rocking partying reputation. UT and A&M love to say that TxState students couldn't get into their schools, but seeing as the requirements to attend TxState are the exact same requirements as UT, it really just proves the point that we don't like to hang with goats fuckers, Wrangler lovers, or ugly theater kids who pretend UT is Ivy League.\n\nWhy Texas State? Texas State hosts the kids you loathed in high school. We had the nicest cars, parents money, and the nicest bodies. It's not our fault that we would like to congregate at the same school and bask in our awesomeness. Are we vain? Shallow? Fuck yeah we are, and we have the absolute right to be. You may hate us because we party harder, rock tighter bodies, and will STILL get better jobs than you because even if we're here for six years, we can network like the fucking best.\n\nHave any doubts? Other universities TRAVEL to party with our school's elite. River Raft Race in one of the biggest parties nationally, with over 2,000 participants this past year alone. People come from Arizona, Colorado, New Jersey, and even California to see what the fuck we're about for just one weekend.\n\nStill hate our school? Then don't even bother heading out to 6th street in Austin, because we've been dominating that party scene for two decades. UT got biggest party school in 2006? You better believe it's because TxState reigns supreme in their own city, and while they may got the books, we've got the looks. We turn the state capital into our own personal Vegas every weekend, and nobody stands in our way. We even come in limos and top-notch party buses, while all you UT fags take sad little taxis.\n\nYour school thinks it has money? Coach bags are our gym bags, and you'll be laughed out if you think Sperry's are expensive shoes.\n\nWhy do we get the greatest jobs? Because our parents are the CEOs, lawyers, and doctors of this fine state. We've gone head-to-head with board members well before this college game, and we make a point to be remembered. Our school has the biggest entrepreneurial spirit and we are feisty; our ego is what powers our greatness.\n\nJealous much? You should be. Sam Houston and Stephen F. Austin only wish to have the caliber we do, and UT and A&M simply just don't know what to do. It's not their fault, how can you compete with a school that's the perfect mesh of street smarts, great looks, and trust funds?\n\nPartying is just part of our nature. We have a fucking BAR in the student center on campus. The only reason you hate is because WE are living the American dream. We toke, roll, yay it out all day because we can and still rape a good GPA.\n\nYou think we're immature and don't want to grow up? Why? Because our parents pay for everything? You're right, it crazy of us to take advantage of the BMWs, boats, Range Rovers, shopping allowances and free trips to Miami and Vegas. Sorry our parents don't want us to work at McDonalds and live on loans. We're not immature, we're spoiled, gifted really, and fuck yeah we're going to enjoy the ride. Maybe if you lost a few pounds and got a tan, we'd let you come along too.\n\nAnd forget about the freshman fifteen, we don't tolerate that here. If you're not a gym rat, just pack your bags. We only socialize with the hottest, and that takes maintenance. So we tan, we work out, we dye, we bleach. You say our girls look like Playboy models? Well, incidentally, we've got those too, just watch the Girls Next Door. Just keep talking about our bleached hair while we average a 168 LSAT score and and starting salary of 70,000.\n\nAnd our boys are just as fabulous. They're built and hot, tan and taunt, they're a girl's fantasy. Our fraternity formals are legendary, and these boys use their street smarts in every way. They own the nicest bars and clubs from Miami to Cancun. They hold more boardroom positions than A&M after graduation, probably because we don't look like Joe Dirt. MTV pleads to film on location here every year, we just can't help that we're that awesome.\n\nSo anyone jealous, just step aside. Go cry how we're spoiled, shallow, and dumb as dirt. You're just upset because you were too pathetic to be invited to the party, it's not our fault we won the genetic lottery. Your right, we'll snub you in clubs and refuse to visit other universities, because why waste our time? You stay elite by eliminating the riff-raff, maybe in a few years you'll make the cut.",0
"Beeruit is a drinking game that spawned from college towns in the late 80s.  Often confused with ""beer pong,"" which is a similar game played with paddles -- this is a game where opponents take turns attempting to shoot a ping pong ball into their opponents beer cups.  Rules vary slightly, but, to better understand the game then the following rules have been highly regarded throughout the years:\r\n\r\n1)  Even teams, usually 2-on-2.  Rarely more than 4-on-4.\r\n\r\n2)  10-cup pyramid formation, ""re-racking"" on 5, 3, 2 and 1.  When 2 cups remain, form a forward line.  When 1 cup remains, center it in back.  ""Re-racks"" (aka consolodations) can only be requested at the begining of each shooting-round when applicable.  ""Tightening"" can be requested as often as you would like.  (eg, ""Tighten that rack for me, please."")\r\n\r\n3)  To see who goes first, a player from each team throws a ball while staring ""eye-to-eye"" with their opponent.  The team that makes the cup goes first.  If neither or both make it, then it is a draw and it becomes another team-members turn to go eye-to-eye versus their opponent. ""Rock-paper-scissor"" is also acceptable.\r\n\r\n4)  After an opponent sinks one of your cups, you must pick it up to drink, keeping track on drinking order amongst your team-mates.\r\n\r\n5)  If a ball goes in a cup that should have already been removed from play, whether the shooter intended to hit the cup or not, then it will be counted as a miss.\r\n\r\n6)  Don't call it ""beer-pong.""  Beer pong is played with paddles.\r\n\r\n7)  Bouncing a ball in counts as 2 cups.\r\n\r\n8)  If a team tries to bounce it, the defending team can swat it after the first bounce.  If you interfere with any non-bouncing shot then you have to drink the cup -- and if possible, the cup closest to where the ball would have landed.  If the interference was an inadvertant result of trying to swat away another concurring bounce-shot, then no cups will be removed from play -- only that shooter gets to re-shoot it.  \r\n\r\n9)  If you knock over a cup, you must fill it back up, drink it, and discard it from play -- no exception.\r\n\r\n10)  In any game, the team must make at least half of their shots for them to receive a ""bring back.""  On a 2-on-2 game, both players must make their shots to get a ""bring back.""  In a game with 3-on-3, then, at least 2 need to make it.  Only team members that made their shots are allowed to shoot again.\r\n\r\n11)  You must finish your drink before you can shoot.\r\n\r\n12)  First team to sink all their opponents cups, wins.  In tournaments there are technically no ties.\r\n\r\n13)  Following a team-victory is always a ""rebuttal"" round, where the losing team must get a final chance for redemption, no matter which team went first.  Bring-backs, naturally, are allowed in the rebuttal-round.\r\n\r\n14) After a team loses, they must drink the remaining cups on the opponents side.  If, after, the ""rebuttal"" round, they manage to sink the remainders, then, for the sake of tournaments, it is technically still not considered a tie.  The team merely avoids having to humble themselves to drinking their opponents cups and it sets up momentum for a probable grudge-match.\r\n\r\n15)  If a ball starts toilet-bowling around the cup, the defending team is allowed to blow the ball out.  Whomever unsuccessfully blows the ball out, should drink it regardless of whos turn to drink.\r\n\r\n16)  ""Courtesy-cups"" or wash cups with clean water are mandatory.\r\n\r\n17)  Distractions allowed -- the funnier and more hostile, the better.  No visual impediments allowed.\r\n\r\n18)  Winners go on to play the next challengers.  Losers refill the courtesy-cups.\r\n\r\nMore tips, surely to be controversial...\r\n\r\nTip #21:  Heating a damaged ping pong ball over a lighter will get the dent out.  Don't get it too close to the flame or you'll have more than a dent.  Submurging the ball in boiling hot water is safer if you have the patience to wait 20 minutes, but the ball gets soft.  Ask that naughty ho to suck the dent out.\r\n\r\nTip #18:  On a budget?  Aluminum foil can be used to make balls.  Out of aluminum foil?  Use seran-wrap and tape if you have to.  Out of seran-wrap?  You got problems.\r\n\r\nTip #25:  Nine-ball play (re-racking in diamonds) is reserved for beginners of the sport.  Eight-ball play (re-racking in pyraminds) is the game most experts play.\r\n\r\nTip #1:  A man shall not allow another to drink his cup for him.  Most, in fact, would forbid it.\r\n\r\nTips #4:  The pineapple/grenade rule is an abomonation to the sport.  This was a serendipitous rule created by a kid who needed something to offset his lack of skill.\r\n  \r\nTip #13:  The elbow-behined-the-table rule is for short people who imagine they are being victimized.  (Think of the kid in elementary school who got teased for being short and cried a lot.)\r\n\r\nTip #14:  Tall people are free to abuse their height-advantage, at the cost of looking like an unskilled cherry-picking fag.  (Think Shaquille O'Neil.)  Both feet are to remain on the ground.  No hands on the table.  Better that you don't lean.\r\n\r\nTip #17:  The title of the game is an obvious reference to the ongoing destruction in Lebanon throughout the decades.  Now you know.\r\n\r\nTip #12:  If the ball bounces back to your side, then you don't get to go again, idiot-boy.\r\n\r\nTip #8:  If the ball bounces 4 times before it goes in, it doesn't count as 5.  It counts as, 'you're dumb for trying.'\r\n\r\nTip #2:  If the cups are so empty that a ping pong knocks any of them over on contact, then it just means that you're not drinking enough.  If the ball is securely in the cup upon tipping over, then count it.\r\n\r\nTip #6:  The same people who mix up wind surfing with sky boarding, are the same people who mix up beer pong with beirut.  They are entirely different sports.\r\n\r\nTip #2:  Don't apply rules from other drinking games.  For example, the ""chicks blow and guys finger,"" rule is witty, but that's about it.  Don't let your insecurities take away from the sport.  Your friend's probably already know your gay, anyway.\r\n\r\nTip #7:  The sniper rule is where, at any given moment, if a ping pong lands in the cup that you are drinking out of then you must chug it immediately.  Sniper shots do not pertain to the game and should not count for or against either team.\r\n\r\nnamaste, dickhead.",0
"A, Word created by a german scientist in the 1920s meant to mean ""how to know"" or ""knowing how to know"" as an attempt at creating a theory of knowledge\r\n\r\nB, [Paranoid] [cult] founded by pulp-science fiction writer and Lafayett Ronald Hubbard who stole the word Scientology to describe the movement originaly named Dianetics after his (unfortunatly) bestselling book after heå«d gotten into trouble with the many people heå«d licensed the name ""dianetics"" to. What started as a (supposedly) self-help book based (supposedly) on scientific experimentation (but since L Ron never made any experiments it was most likely dreamt up from his somewhat warped and drug-influenced imagination, much like his war record which allthough claimed by Hubbard and the church to be outstanding most notably includes him ordering the bombardment of an iron deposit on the sea floor mistaking it for a submarine and him almost dragging Mexico into the WWII by using a mexican island for target practice) grew into a movement after people started sending L Ron money to be educated as auditors (the people performing one of the most essential (and possibly brain-washing) techniques of the cult to supposedly help people). L Ron later created scientology as a way of gaining more control over the training and for him most essentialy the money payed to the movement.\r\n\r\nAmong the history of scientology a few things stand out:\r\n1, Hubbards many and always failing attempts to ingratiate himself with various governements which usually ended either with some form of prosecution or in a few cases with scientology being basicly kicked out of the country (as they were from Greece). The most prominent being the conflict with the US governement. Hubbards contact with it started with his rather failed serving in the navy which only earned him a couple of medals that where handed out to anybody whoå«d served in an arena of the war and a disability pension. After the war, during the fifties, Hubbard frecuently sent letters to the FBI. Among other things claiming that his ex-wife had tried to kill him. The FBI apperently thought of him as a nutter. Later the IRS started investigating his various enterprises which lead to him leaving the country.\r\nThe weirdest part of this conflict was the fact that several cult-members managed to infiltrate federal buildings and copying IRS-files being used against the cult. When this was discovered many cult-members were pu on trial and sent to jail, including Hubbars wife.\r\n2, Hubbards overly inflated claims about himself that always seemed to grow larger with each telling which the ""church"" has never tried to correct.\r\n3, Hubbards growing paranoia until his death in seclusion attended only by a few of his closest aides (of which most were booted out of the cult or punished by David Miscaviage, the current cult-leader) which manifested itself with his inventing at first Sea Org and then several other organisations within the cult supposedly in control (which ultimatly led to a power struggle between the organisations) then the Rehabilitation Project Force (an in-cult concentration camp aimed at punishing people who dared to think individually, in cult-lingo called ""to put ethics"" on someone which also stands for other kinds of punishments).\r\n4, The cults persecution of outside critics (inside ones were either booted out or put in RPF). The cult is noted for it's extreme use of basicly frivolous lawsuits used to harass all critics, in one case it even succeded to put the Cult Awareness Network into bankruptcy and then bying the rights to its name and launching its own website under the name of the New Cult Awareness Network (which is noted for its extreme pro-cult policies and actions and is to be avoided). The cult has also managed to falsify charges against the author of a cult-critical book which almost sent her to jail. The author is/was Paulette Cooper and the book The Scandal of Scientology which was published in the 1970s.\r\n5, The cults extreme fees needed to advance within the many levels of the cult and the tendency for these to increase both in size and in number.\r\n6, The cults focus on recruting celebrities and these celebrities diverse success in recruting new members to the cult. The question remains open as to whether Tom Cruise is an asset or a liability to the cult.\r\n7, The cults ""war"" on psychology. While the cult is activly fighting against all forms of psychotherapy (one wonders if this is a symptom of L Rons own fear that he was mentally ill) most psychologists seems blissfully unaware of this so-called war.\r\n8, The cults manipulation and oppression of its own members, a sure sign of a destructive cult.\r\n9, The cults extreme beliefs, derived from Hubbards equally outlandish books. Which includes:\r\nThat we all can remember everything from some time before conception (called: ""The sperm dream"").\r\nThat we can remember past lifes (including lifes lived on other planets)\r\nThat women try to abort most of their children several times during the pregnancy (each of which is remembered by the fetus)\r\nThat the fetus suffers and can remember when its mother was constipated\r\nThat the fetus remembers arguments verbatim and can later start to act accordingly(exemplified by a woman hearing her father raping her mother while she was in the womb and screaming ""take that"" leading to the woman later becoming a cleptomaniac)\r\nThat sex is degrading and was forced upon us by evil aliens (a statement Hubbard made late in life when one can suppose, his own equipment wasnå«t in good working order)\r\n10, The setting up and use of exterior supposedly independent organisations to attack critics of the cult and everyone the cult feels is their enemy. Organisations that go very far when trying to hide their connections to the cult. The cult has even tried infiltrating many organisations that have critisized the cult.\r\n11, The fact that in lawsuits the cults arguments are often inflated and sometimes contradictory with themselves or with the fact that they are supposedly a church.\r\n\r\nMany have called Scientology a schizoid cult and wondered whether this was a reflection of its founders mental health. A psychologist talking about the cult thought that L Ron Hubbard was more similar to a necrophile, similar to hitler.\r\n\r\nFor sources and even more nuttyness, check out these sites: operation clambake, factnet, the smoking gun(which has all of Hubbards letters to the FBI), wikipedia and youtube\r\nand these online books:\r\nThe Scandal of Scientology, A Piece of Blue Sky, L Ron Hubbard: Messiah or Madman?, Scientology, The Now religion",1
" A [poser] who  takes all the REAL hot boys (like a [whore]) from the girls who deserve them (the real skateboard girls)\r\n\r\nExample: If Katie is a skateboard poser whore, then she flirts with all the real skateboarders until they leave their real skateboarding girlfriends.",1
"""twat‰Û refers to a woman's vaginal region, or is a ""nickname"" for that area.  That means that a ""twatriot‰Û is when a woman switches into ""super overdrive"" while she is engaged in any type of sexual activity.  It often is what every man dreams of while pleasing his woman...",1
"(Noun) The act of digitally penetrating ones partners' anus (and/or rectum) while under the influence of alcohol and/or narcotic(s) under the pretense that it is in-fact the ""partners'"" vagina yielding a brown ring-like stain encompassing the radius of the offending finger.   ",1
"(verb)\r\n1. To excel at a skill, task, or value in a superlative manner.\r\n2. To engage in ineffable, mind blowing sexual intercourse. \r\n\r\nOrigin: Inspired by actor James Franco's rumored sexual prowess that women dream to experience and men aspire to emulate.\r\n\r\nEx.",1
"-A robot that you can talk to on msn messenger. Basically the female version of [SmarterChild].\r\n-Always makes up excuses like, ""I'm new, so I can't answer much"" in the face of comments or questions that she's too thick to answer.\r\n- Creeper robot who knows where you live.",1
"-one who jumps in and out of puddles shouting 'i'll find ye treasure matey!'\r\n\r\n-a man who 'gets around' (male prostitute), and during his orgasm screams 'Arrrgghhh, thereeeee she blows!'; The puddles symbolize a woman's vagina, and the pirate represents the horny man.\r\n",1
". A dick/penis\r\n Most commonly used by girls towards other girls, but can be directed towards guys too.\r\n  That girl you hate at school who completely ruins your life, steals your boyfriend and spreads nasty rumors about you.  The kind of girl you don't want to make mad.  ",1
"1) a series of offensive words, used in an undesireable situation.\r\n2) a series of offensive words, used only to shock or disturb those around you.\r\n3) an insulting request, translates to ""have sex with this piece of poo, you who has a vagina in the place of their rectum.""",1
"1) an individual who throws up more than once in an evening 2) An individual who is so drunk they decide to mix beer and peels 3) An individual who is nominated drunk girl/guy of the night 4) An individual who cannot remember any of the 3 above definitions 5) Nicole Middendorf",1
"1) one who is conceived as a result of a failing condom\r\n2) the act of destroying the thin rubber sheath that stands between you and any feeling whatsoever\r\n3) the fabled fourth hole right behind a woman's knee that can only be seen under the right lighting conditions.\r\n",1
"1)A girl that is a [slut]. She is a fat girl, that lies repeatedly. She would be on any boy's dick. She's also a bitch, that can't fight anyone.\r\n\r\n2)A very ugly girl, that never leaves her house. \r\n\r\n3)A girl that was played, and used. That can't admit she is a skank.",1
"1)a black woman with an abnormally large ass, even by black standards\r\n2)an incredibly lazy, annoying manager who thinks she knows everything about everything, but really doesnt know anything\r\n3)an uber bitch with absolutely no respect from her employees or her husband\r\n",1
"1. A shitpicket is where you stick your finger up a female's anus, grab some shit residue, and slide it out. You then insert your finger into her vagina and clean it all off. She then licks your finger clean.\r\n\r\n2. A dirty nigger who likes to eat shit, or smells like shit.",1
"1.) pencil-thin, irresistable asian female that thinks everything that comes out of a male's mouth is a load of cow manure.\r\n\r\n2.) Tiny petite asian girl that drives a vehicle with more horsepower than yours.  In other words, your Geo Metro is gonna get stomped on.\r\n\r\n",1
"1.The definition is when a woman has found that her relationship with other men proceeds more then what meets the eye.\r\n\r\nFor more then 4 friends (males) involving with the woman.\r\n\r\n2. An insult that is all insults put together there for creating the ultimate insult. ",1
"1.When you sneak up on a girl in the middle of the night and stab her in the back with a sausage. Repeatedly.\r\n\r\n2. A dick or penis.\r\n\r\n3. Also can be made into a drink by placing a slim jim into a bloody mary. Generally, it's garnished with cheese on a plastic sword. ",1
"A ""Romy"" is the female version of Robin Hood, while he has ""merry men"", she has ""many men"".\r\n\r\nA Romy generally has between 3 and 10 men on the go at once, but usually only likes one but because of his ""Little John"" she keeps several other men around her, just in case.\r\n",1
"A Female that gets around. A slut, tramp, whore, etc... Originating from the classic song ""Run around Sue"" by singer Dion in 1961, the song clearly explains a lose woman that ""took my heart and ran around, with every man in down"". It is a more classy way to call a girl a Slut.",1
"A WOMAN with shit breath but pretends to be a man, who surely is a woman, with rabies, diarrhea and nipple infection. AND THE YEAST OF DOOM!!!!!!!!! The name Hellens is also a toe infection from the year 1996 discovered in a ugly baby with down syndrome, or just looks unusual.",1
"A difficult high risk, well scoring sex move to really show a special lady you fuck well. Best performed on a couch in which the female is squashed in the corner inverted and the male performs dabbing motions straight down with her legs front and back to form an Egyptian boat.",1
"A disgusting horny man whore who finds anything with a vagina attractive. Uses the term dude when talking to alleged 'friends'. Likes to talk to the herbs daily. Other terms associated with horse dick: pizza face , simba and horse. Wanna be Elvis. Has never heard of proactive.",1
"A disturbingly unattractive protruding bellybutton, particularly on an otherwise attractive female, so pronounced as to be reminiscent of a small penis. First appeared on paparazzi websites describing bikini pictures of talk show host Kelly Ripa's unnaturally protruding navel.",1
"A female that is used to end to end a period lacking females. A slump buster is, generally speaking, less than what one's standards would be, had the person using the slump buster been in a time flourishing in the female department. It is usually looked back upon as a mistake.",1
"A female that would be considered attractive in the sense that she has profoundly large and appealing breasts, however, the fact her arms are really short and do not grow past her breasts (like a t-rex) lowers her attractiveness and makes her look like a mutant dinosaur-human.",1
"A female who is known to have sexual relations with numerous persons and is known to be ""easy"" or ""fast"", and as a result of being a shone the female will become pregnant and usually will not know who the father of the baby will be, AND/OR she will come in contact with an STD.",1
"A generally obese [twat] with a face like a badly bashed 1983 Mercedes. Often is the bane of most schoolyard jokes and rightly so for they are often those kind of fat [bollock brains] who think they're amusing-fat whereas they're just obese-fat. Originates from the north-west.",1
"A girl (usually teenage or early 20's) who self-diagnoses a gender identity disorder, gets a terrible haircut, starts insisting upon male pronouns and integrates themselves into the trans community before abandoning the idea and going back to sucking cock after about 6 months.",1
"A girl or woman who is continually flipping her hair without touching it by tossing her head, often using the motion to catch a quick, surreptitious glimpse around her surroundings and/or to see who, if anyone, is looking at her, and/or to garner attention. (See ""Headshaker"".)",1
