"Definition","is_misogyny"
"A game where you play as a U.S. Army soldier who is equipped with high tech intelligence gathering equipment and weapons. Derived from the U.S. Army's land warrior project which integrates technology with weaponry keeping the soldier informed with real-time intel. This will make the soldier even more deadly when planning coordinated attacks on an enemy position. And with the use of the internet, spy drones spy satellites, thermal imaging this will enable an average soldier to find and destroy an enemy who has no where to hide.",0
"A girl who doesn't think like most girls because she is mentally and physically strong but still is very feminine and delicate. She loves to laugh and is up for anything. She has a heart of gold. And has a great love for the beach and water. She is a leader and knows how to get the party started. She can be crazy when it's ok to be but can also be calm and controlled when the time calls for it. Sophie is a very nice and a talented person. she is a very smart and talented person who can do anything when she puts her mind to it.",0
"A girl who is usually prettier on the inside than the outside but is too afraid of being judged to show it. She loves animals and is only herself around those she trusts the most. Sometimes that isn't even her ""friends"" at school. She has a god given gift for almost everything she puts her heart into. She is very religious and says her prayers every night even when others say it isn't cool. Most of all this girl will always be shot down by her friends but will get back up until she finally makes a comeback and rules the world.",0
"A guy who is shy at first, but once you get to know him, is a friendly, funny, generous, and overall social person to you depending on your attitude towards him and others. Jacob is a dude who shines his brightest around those whom he considers a friend, as he tends to get confident when around them. Jacob is philosophical and wise even if he denies it due to his modesty. Jacob might be made fun of by some, but is something just barely short of an attraction towards reasonable and similar people who see the world like he does.",0
"A inguagiato is known as a sloppy, gross person who has a hint of bourbon to his/her breath and smells of shame and tears. Most inguagiato enjoy harassing a torturing young children who cannot defend themselves. When inguagiato gets stuck in a argument with a person and finds themselves wrong, they often turn to insults, racist comments, or the simple saying, ""You know what...? Stop."" most inguagiatos can be found in New Jersey, the migrate down to Georgia during the fall, mysteriously, with no trace of background information.",0
"A kickass biomedical engineer with absolutely zero common sense. Terrible at throwing a frisbee. A shoe-in for the Darwin Award. A hooker that can often be found of the strip of Vegas or meandering around the Fox Theater in Saint Louis, Missouri. He charges quite a pretty penny for his body, but sources say he is definitely worth it (plus it's a good cause because the funds go towards his friend's law school tuition). Despite his faults, Hugo is greatly loved by his friends, who are the sole reasons for him not being dead yet.",0
"A male, usually of the small, gingery, freckled variety, who uses his innocent appearance and mastery of the English languages to woo females, despite the fact that he resembles nothing more than an undernourished red squirrel that is too stupid to come in out of the rain. When his duplicitous nature is eventually uncovered, he lashes out with ineffective character assassinations. A Mack is never a serious threat, because, despite his advanced vocabulary, he still has a weak grasp on the difference between ""your"" and ""you're"".",0
"A man of 13 offenses-Sign that he is the spawn of [Satan]\r\nKnown widely as a sex offender, who prefers spankings and shop-lifting Hispanics and playboys. Was fired for sex offense from Columbia High School, got rehired as a gym teacher in an elementary school, moved up to [Maplewood Middle School], and once again ended up in [Columbia High School].\r\nBesides his desire for young men, Wayne is also a man of beauty, and knows how to dress and throw stacks. Wayne Calandriello is therefore the greatest gym teacher of all times.",0
"A maneuver in which a girl inserts a statement about her boyfriend to let any would-be suitors that she is already taken. In some cases it is used by single women who want to let a guy know that she isn't interested. Despite the violent name of this act, also called the [boyfriend drop], and the pain it may cause for the male recipient, the boyfriend bomb is actually an act of kindness in either case. The girl is simply trying to show that she is taken or not interested, before the guy asks her out and makes an ass of himself.",0
"A mediocre horror movie with plenty of blood, but not enough ass. The basic plot is as follows:\r\n\r\n""Hey guys, lets go spelunking....who's this butch that every viewer is going to think is a lesbian, but because it is a below-average movie, we are going to deny them the gratification of seeing girl on girl action deep underground? And wtf.. we're getting chased by mutant miners? Ok i'll buy that.. so apparently, after escapting from the cave, the ghost of my previously wtfpwned daughter suddenly appears in my car! Liek OMG!",0
"A melt down is where someone completely fucks out.\n\nIt involves the following ingredients, the person must be just about black out drunk, and they do something that is completely ridiculous such as kick a car door in, break items, cock block their mates, vomit uncontrollably and for it to a true melt down there needs to be tears by the perpetrator. These are not pretty sights and they need to be handled with care to stop a multi-meltdown by the perpetrator.\n\nMoutra Mode is the early signs that a melt down may be coming on.",0
"A metaphor for junk food, but refering to girls.\r\n\r\nIt's when a guy is so desperate and horny that he lowers his standards to staring at fuglies and telling his friend that she is worth picking up ... only to realise after 20 min that she is dog like a mofo.\r\n\r\nThese girls are called mc'junkies because it is only when you are very hungry and broke that u consider eating shit like maccaz. After 20 min u then feel the messed up digestion which u can only blame yourself for. \r\n\r\nYes fellas the shit is deadly. \r\n\r\n",1
"A mockery of ""hardcore"" defined as a member of the National Guard (typically, though not necessarily a [Guard Bum]) who has served six years or more without a combat deployment, avoids deployments, or always seems to end up with cushy missions to Europe, the Baltic, or Central America. A Guard-Core Soldier or Airman is usually seen decked-out in more gear than necessary, is typically overly enthusiastic given his/her limited experiences, and frequently incorporates recruiting paraphernalia into his/her daily civilian wardrobe.",0
"A mythical [alcohol] [fairy] that comes to the aid of [drunk] people looking to hook up at [parties]. Anecdotal evidence has suggested that the Partyka is so good at what it does that if there are no possible human hook ups in your proximity, it will find you something to sleep with. Partyka has been known to elicit such responses as ‰ÛÏoh man, that drunk guy is literally having sex with that lamp shade‰Û and ""my god, Magdalena really sees the inner beauty in people because that guy she is hooking up with must be 600 pounds.""",0
"A nerdy self deprecating word used in a humorous way. Otherwise, a lame twist of ""hacker"" using ""l337"" speak. \r\n\r\nAlthough there is sometimes an attempt to make it synonymous with ""hacker"", there is no wide acceptance of this in the real world. Circles where it might be accepted as such will not be among true hackers, but instead ""crackers"". aka skript kiddies, skript d00dz, losers, lamers, sad fucks with a sad sense of entertainment who basically spend hours racking their pin heads on pranks they don't often even witness.",0
"A niyat is a living thing who doesn't know she's a great person but everyone around her knows she is. A niyat is something that isn't great for first impression's but if you get to know a niyat you won't regret it. A niyat is cute, funny, and usually has a very nice bottom. A niyat can be found online ps3 and if your lucky enough to find one don't annoy or pester her because her boyfriend is watching over her like a guardian angel. If you are even lucky enough to date a niyat you should be very happy and try not to mess it up.",0
"A particularly driven individual who will not settle for anything less than perfect. Her expertise on good times along with an active sense for adventure make it very easy to spend time with her. Although loquatious, she is a careful listener and will make one feel good about whatever he/she has to say. A well rounded personality indeed.\n\nAll this wrapped up in a sexy package.\n\nConsider yourself screwed if you find out how to get on her bad side. A combination of her wit, stength, and loyal friends will surely cut you down",0
"A person who just so happens to listen to and/or follow Psychopathic Records or the horrorcore genre. The stupid little rednecks and ass holes who call themselves juggalos are not real. Theyre trying to fit inside a group of people to make themselves feel special. Please stop making assumptions about who we are based on these random fakes. And to all you people out there who come on urban dictionary just to try to bash us or call our music gay, taste is completely subjective. Just because you dont like it, doesnt mean its bad.",0
"A person who shows severe symptoms of apple technology addiction.\n\nOften resulting in the appict standing in lines for the latest product release, obsessive dialogue regarding apple products to those who do not care and late night rituals where the appict awakes for the keynote presentation.\n\nAn appict will often upgrade to the latest apple product (even if only for minimal technological gain) just so they may ease their psychological addiction. A euphoric state is reported once the appict obtains the latest apple product.",0
"A person who thinks he is a hott shot and can melt hearts, but, really is a loser in life. He meets girls on Plenty of fish stating that he works, has friends, and is too busy with sports to search for the girl of his dreams. When actually, they are homeless, friendless, inactive men who try to sleep with women so that they can have a place to stay for the night. Usually extremelts go by the name of Levi and try to get you drunk on the first date. Their pray are women who go by the name Princess Sara... SO Saras, take caution!",0
"A phrase used in connection to the town of Berkhamsted, Hertfordshire, to describe the complete isolation of it's inhabitants to the outside world. It is a town of extremes, where the rich rub shoulders with the pseudo-poor (true poverty doesn't exist here). A juxtaposition of the beauty of the chilltern landscape against the grotesque failings of human nature. But alas, the failings and flaws of this historic town go ignored, unseen, brushed under the rug, by the parochial, closed-minded natives and the bubble remains intact.",0
"A pillow partition is a section of pillows placed between two bedmates, who are not lovers, to avoid any accidental touching while asleep. The bedmates using a pillow partition are typically heterosexual males, who are forced to sleep in the same bed on a trip for logistical reasons. If one male is straight, and the other's sexuality can be considered a bit [ambiguous], the pillow partition is a necessity. It can also be used to [save face] to any other males on the trip who might joke about the two bedmates sleeping together.",0
"A prep is not always a stuckup bitchy snob. Generally, preps are rich, but I personally know many preps that aren't. Technically, a prep is somebody that goes to preparatory school, but in the real world, it is somebody who shops too much for their own good. Many people who are not preps use the words ""like"" and ""totally"" such as myself. Most preps like to flip their collars and wear bright ribbons in their hair. They love polos, and shop mostly at Abercrombie, Lacoste, Ralph Lauren, American Eagle, Hollister, and Aeropostale.",0
"A private Christian university in Redding, California. Where partying, sex, or use of alcohol or drugs is forbidden; pretty much any normal college behavior is frowned upon. But lets be real, the ""christians"" here are less than Godworthy. Judging and snitching are two of the most popular hobbies on campus. If you happen to attend this school, you are either here to inforce you religion on others, or came strictly for sports. However, the athletes here are hated and looked at by many as if a swastika is stamped on your forhead.",0
"A quantitative measurement of one's promiscuity to allow for easy comparison, bragging, etc. It is calculated by multiplying the number of sexual partners with the combined age difference. The combined age difference is calculated by adding the age difference to the most younger partner with the age difference of the most older partner.\n\nIf I have slept with 5 people, and the age difference to the most younger one is 2 years + the age difference to the most older one was 3 years, then my dirty number is\n\n5*(2+3) = 5*5 = 30",0
"A rabbit who breathes fire. He was born in 1987, and started the 1988 Yellowstone fires. He had to go into hiding in 1989 after the government put a bounty on his head. He came back out of hiding in the year 2000, and has been going around burning things down ever since. Nobody knows why he breathes fire, he was just born that way. He eats Hot Tamales and spicy foods for fuel. He once formed a hard rock band called [firebunny], but it didn't last very long, as he had a bad habit of lighting the place on fire after every show. ",0
"A rare species usually found to be residing in the Ghetto Areas of Birmingham. A strange concept is the fact that he belongs to the male gender however the connation‰Ûªs revolving around the name are female making him all the more exciting. \r\n       Can be found in dark corners cutting himself and telling the rest of us mere mortals about the illumaniti take-over when we shall all becomes slaves being done up the arse. \r\n                 A tad emo.\r\nComes up with the coolest acronyms like SMD Pl0X\r\nWeird. But cool.\r\n",0
"A really sweet and adorable guy. Usually has light brown hair and eyes similar to small partial-eclipses with most of the iris blue (the sky) and gold rays (sun)surrounding the pupil (moon) . Extremely smart and well behaved typically religious. Always gets straight A's and is somewhat of a teachers pet. Usually very athletic playing multiple sports; football, basketball, track, etc. Most girls do not notice the appeal of this type of guy when first meeting him, but after becoming friends they swoon at the mention of his name.",0
"A shop in vocatioinal high schools that is completely pointless. Were all the people who are retarded enough to take an everyday chance of dieing go into. Anybody that takes this shop feels inportant because they do the average easy work that 75% of americans are too lazy but yet capable of doing themselfes. After taking this shop you will learn two things. 1 how to tac wires up against a beam and rip them apart after and 2 you just wasted 4 years of your life hangingåÊ out with a bunch of guys in a room with a bunch of wires.",0
"A skank, slut, whore, and harlet so basically Paris Hilton and Gabrielle Solis (whose ""adultery gave her valuable life skills"")\r\nPronounced very quickly in order to insult as quickly and efficiently as possible. The best way to say this word quickly is when someone insults you so badly you have a seizure and therefore, say you little ""sklorutharlet"" very quickly in reply. (This word applies to a variety of women, some of which may in fact me from the 1500s when the term ""harlet"" was enjoyed by Shakespeare and his sex jokes.)",1
"A somewhat old fellow who knows everyone in at your local store, restaurants, cafes, bars, etc. Often mistaken for a lazy, useless homeless man, but in reality is a pretty chill bro. No one else is as much fun to be around and as fun-loving as Panchi's are; they are often good with kids and essentially the light of every event, place, or party they go to. Panchi's are generally musically inclined and wonderful artists. Most Panchi's always have a good joke or two up their sleeves. Panchi's are the chillest dudes on the planet.",0
"A song that is loved by many on a huge scale. For example most of the music from 1999-2009 is classed in this category. The song 'where is the love' by the black eyed peas would be classed as a banging tune (TBH all black eyed peas songs are banging tunes.) but some songs are good just not quite to the level of banging that we might hope. Today's music will never amount to that of the past. It was a sad day for me when I spoke to a child who knew who iggy azalea was but had never heard of s club 7. What is the world coming to?",0
"A special build from the popular semi-MMORPG Guild Wars. A 55hp monk is a normal monk with all superior runes in his armor. This causes his hitpoints to reach 55. When using a combination of Warrior and Monk protection skills, he is almost unkillable. \r\n55hp monks are usually used for farming (killing enemies to get good items) in the Underworld.\r\n\r\nThis build is useless, however, without a good SS necro. An SS necro is a necromancer/mesmer who uses Spiteful Spirit (SS) on enemies while they are attacking the 55hp monk. ",0
"A specific type of girl, usually very good looking, who uses her looks to manipulate the people around her. She is most comfortable hanging around the [douchebag] crowd. She usually has very little to offer, other than her looks, and is frequently used as eye-candy by the [douchebag guys] to make their party seem more appealing than it really is. A look at me girl is fake, usually a liar, and gains her self esteem through sexual encounters. She will be found with the guy who has [out-douched] all of the other [douchebag guys].",1
"A sweet and sexy spitfire, Sarah-Nicole is the epitome of artful beauty. You won't find a more generous person on the planet. Characterized by deep feeling, Sarah-Nicole will look to poetry and music as the ultimate expression of her inner voice. Often has large, delicious breasts and a fine butt. Don't let her size fool you, she will lay you flat with her mastery of a myriad fighting styles! Not to be confused with nyads, dryads, sirens, or pixies. A common mistake is to spell this name without an ""H"" and/or without a hyphen.",1
"A teenage male skater/biker.  Usually  seen loitering around the park everyday trying new tricks because they are doing what they love (and they have nothing better to do).  Usually a slacker and not involved in any school activities.\r\nSome guys are more typelike than others.\r\nLOOK FOR:\r\nchains, long hair, skateboards, BMX bikes, mohawks, skater shoes, baggy pants, studded belts, skate company/ band T-shirts.\r\nTYPES COME IN: groups of five or more.  All types know eachother if they are from the same city/ general area.",0
"A time of the year the world of television programs where the virgins become sluts, the straits become gay, the mild-mannered become basket-cases, likeable characters turn out to be evil and/or die, couples cheat on eachother, the selfless turn selfish, someone gets pregnant, and just about any other thing that the creators can think of to boost their show's ratings enough to avoid getting cancelled by the network executives.\r\n\r\nOften as soon as sweeps week is over, all these elements are suddenly written out or forgotten.",1
"A town in Oregon located approx. 20-30 mins outside Portland, Oregon. Nothing spectacular happens here. There is the Buckeroo Rodeo once a year thats about it.  The high school has a recently appointed principle who runs the school like a dictator and uses fear and threats to get students to tell on each other.  There are also quite a few rednecks in Molalla. \r\n\r\nThe town is named after the local Native American Tribe. The football team is called the Indians, in fact every sports team out of Molalla is called the Indians. ",0
"A transvestite ie someone who wears the clothes of the opposite sex for fun or sexual enjoyment.\r\nTranny mainly applies to men that wear women's clothes and often over overly feminine and parody women.\r\nCan be derogatory when used by a non-[transgendered] community member but is seen as a term of endearment within the community.\r\nNot to be confused with [transsexual] which is a person who's outward gender is non-concurrent with the gender of their brain and is treated with hormone therapy and gender reassignment surgery.",0
"A type of teenage girl found in Dublin, Ireland usually found plastered in fake tan straightened hair with a fuck load of extensions and bright pink lipstick.\r\n\r\nWhen taking pics for bebo they arch their back and stick their ass and tits out while making a piece sign with thier fingers and doing a weird pout with their lips. They say babes a lot and wear leggings without a skirt....sick \r\n\r\nThey also have a secret language when talking on bebo something like \r\n""ii luff mii baaaaab3y"" translates to i love my baby \r\n",1
"A weebler is someone who is completely indifferent about anything happening to them or around them, but are also nice people. For example when a weebler is sitting watching tv they may have food crumbs on their shirt or on their stomach if they are not wearing one. Weeblers are very lazy people and complain about doing rather simple tasks that need to be completed. When they are moving they do it at an extremely slow speed which can be described as weebling around. They are also typically stoners and play hours of video games.",0
"A widely-used Chinese term, literally translated in English as ""hot air"", is used to describe the idea of a state of ""unhealthiness"", when one's urine is very yellow, has an odor, or if they eat too much junk and processed food which is a common excuse for nosebleeds, oily skin, and a sense of unwellness.\n\nHeat Evil is caused from drinking large amounts of liquids that contain water, but is not purely water, such as soda and juices. Most of the time, urine that is yellow and has odor is caused by the lack of intake of water.",0
"A woman who is a cuckoldress and expects more than just another man to have sex with. This woman believes her husband or boyfriend isn't worthy of her body so she leaves him in the cold while she finds other men to play around with. It's usually an open relationship where he knows all about her lovers. Her husband or boyfriend might even help her get ready and pay for the date as well while he sits at home alone and waits for her big date to end. He might even watch the outcome or more if the cuckolding princess allows him to.",1
"A young person (not necessarily a schoolgirl) raised in a strict moral upbringing (not necessarily a Catholic) who acts completely opposite to the views they were taught in a way that is generally out of control and without care. Because they were taught that everything is equally sinful, they feel that any and all actions are morally equal (ie: kissing a guy is on par with sleeping with the football team) and not taught control, restraint, or moderation and instead taught only abstinence (ie: excessive uncontrolled drinking).",0
"AKA post coital club. A club for sexually liberated and usually blonde women to discuss who/what/when they last got some cock.\n\nIn a world where men seem to be able to brag about their amount of sexual conquests and are said to be ""lads"". This is a safe environment in which the words [fuck] cock, dick, [arse] and penetration are readily accepted by strong and independent women.\n\nThe most devoted and hardcore clubs will even include a scoreboard or ""lad chart"" in which each member receives ""lad points"" for slutty behaviour.",1
"Adjective: describes a type of person who appears untrustworthy or sketchy, and will quickly encroach physically on your personal space whenever you are not looking at them directly.\n\nNote: Usually best dealt with by putting as much space as possible between you and this person(s) immediately.\n\nSometimes you will need to use a long, very hard and intimidating stare to shame them into backing off. This is what you can do if you are not able to leave the vicinity immediately, for example you are in line at the grocery store.",0
"Also known as (P.E.A) The process of when right after a man ejaculates, a trigger occurs and the man's mind and emotions are completely clear. After ejaculating they do not care about anyone or anything and has a huge impact on there decision making. Thats why most guys leave after sex or feel very comfortable around there partner. It is also used as a defense mechanism against women. You see women posses the power of manipulation threw emotions, while guys posses the power of clearing out emotions, but only threw ejaculation.",0
"Also known as the Belarusian Tortilla, the Russian Burrito is the foremost sexual maneuver that satisfies both the libido, and the appetite. The act itself involves a Prokofiev MP3, a fifth of Smirnoff Ice (preferably Raspberry flavour) and a third of can of refried beans. Executed to perfection, the gentleman caller must pour the beans into his lover's tortilla flaps (labia minora), and douse it with back-washed girly vodka. Follow this up with a solid donkey blow to her spinebone and voila- a tasty, homemade Russian Burrito.",0
